{
    "schema_version": "1.0",
    "id": "ORD-20250714-001",
    "created_at": "2025-07-14T10:00:00Z",
    "created_by": "Morty",
    "project_id": "ASPACE-MCP-V1",
    "cycle": {
        "type": "12WY",
        "week": 1
    },
    "rock": {
        "title": "MCP Gateway Operational",
        "definition_of_done": [
            "Gateway accessible via HTTPS",
            "Logs passifs vers Jerry actifs"
        ]
    },
    "tactics": [
        {
            "id": "T-01",
            "domain": "IT",
            "action": "Deploy Docker Container",
            "owner": "Summer-IT",
            "dependencies": [],
            "acceptance_tests": [
                "docker ps returns status up"
            ]
        }
    ],
    "constraints": [
        "Usage de Python 3.11-slim"
    ],
    "escalation_rules": [
        "Si CPU > 80%, stop instance"
    ],
    "linked_decision_id": "DEC-20250714-001"
}